{
  "metadata": {
    "version": "1.0.0",
    "created_at": "2025-09-28T22:34:35Z",
    "updated_at": "2025-09-28T22:34:35Z",
    "author": "Product Manager",
    "project_id": "proj-task-manager",
    "provenance": "business-user-conversation",
    "data_classification": "internal",
    "checksum": "a1b2c3d4e5f6789012345678901234567890abcdef"
  },
  "requirements": [
    {
      "id": "REQ-001",
      "title": "User Authentication System",
      "description": "Users must be able to create accounts, log in securely, and manage their profiles. The system should support email/password authentication with optional two-factor authentication.",
      "priority": "critical",
      "complexity": 7,
      "business_value": "Essential for user security and personalization",
      "dependencies": [],
      "tags": ["authentication", "security", "user-management"]
    },
    {
      "id": "REQ-002", 
      "title": "Task Creation and Management",
      "description": "Users should be able to create, edit, delete, and organize tasks. Tasks must have titles, descriptions, due dates, priority levels, and status tracking.",
      "priority": "critical",
      "complexity": 6,
      "business_value": "Core functionality for task management application",
      "dependencies": ["REQ-001"],
      "tags": ["tasks", "crud", "core-feature"]
    },
    {
      "id": "REQ-003",
      "title": "Project Organization",
      "description": "Users need to organize tasks into projects. Projects should have names, descriptions, and the ability to contain multiple tasks with shared settings.",
      "priority": "high",
      "complexity": 5,
      "business_value": "Enables better organization and workflow management",
      "dependencies": ["REQ-002"],
      "tags": ["projects", "organization", "hierarchy"]
    },
    {
      "id": "REQ-004",
      "title": "Real-time Collaboration",
      "description": "Multiple users should be able to collaborate on projects in real-time, with live updates when tasks are modified, created, or completed.",
      "priority": "high",
      "complexity": 8,
      "business_value": "Enables team productivity and coordination",
      "dependencies": ["REQ-001", "REQ-003"],
      "tags": ["collaboration", "real-time", "websockets"]
    },
    {
      "id": "REQ-005",
      "title": "Mobile Responsive Design",
      "description": "The application must work seamlessly on mobile devices with touch-friendly interface and responsive layout that adapts to different screen sizes.",
      "priority": "high",
      "complexity": 4,
      "business_value": "Ensures accessibility across all devices",
      "dependencies": [],
      "tags": ["mobile", "responsive", "ui-ux"]
    },
    {
      "id": "REQ-006",
      "title": "Task Notifications and Reminders",
      "description": "Users should receive notifications for approaching due dates, task assignments, and project updates via email and in-app notifications.",
      "priority": "medium",
      "complexity": 6,
      "business_value": "Improves user engagement and task completion rates",
      "dependencies": ["REQ-001", "REQ-002"],
      "tags": ["notifications", "email", "reminders"]
    },
    {
      "id": "REQ-007",
      "title": "Search and Filtering",
      "description": "Users need to search tasks and projects by keywords, and filter by status, priority, due date, and assigned users.",
      "priority": "medium",
      "complexity": 5,
      "business_value": "Improves user productivity when managing many tasks",
      "dependencies": ["REQ-002", "REQ-003"],
      "tags": ["search", "filtering", "productivity"]
    },
    {
      "id": "REQ-008",
      "title": "Data Export and Backup",
      "description": "Users should be able to export their data in common formats (JSON, CSV) and the system should automatically backup user data.",
      "priority": "medium",
      "complexity": 4,
      "business_value": "Ensures data portability and security",
      "dependencies": ["REQ-001"],
      "tags": ["export", "backup", "data-portability"]
    },
    {
      "id": "REQ-009",
      "title": "Performance and Scalability",
      "description": "The system must handle 1000+ concurrent users with response times under 200ms for common operations and support horizontal scaling.",
      "priority": "high",
      "complexity": 7,
      "business_value": "Ensures good user experience as the platform grows",
      "dependencies": [],
      "tags": ["performance", "scalability", "nfr"]
    },
    {
      "id": "REQ-010",
      "title": "API for Third-party Integrations",
      "description": "Provide RESTful API endpoints to allow integration with external tools like calendars, email clients, and project management software.",
      "priority": "low",
      "complexity": 6,
      "business_value": "Enables ecosystem growth and user workflow integration",
      "dependencies": ["REQ-001", "REQ-002"],
      "tags": ["api", "integration", "ecosystem"]
    }
  ],
  "acceptance_criteria": [
    {
      "requirement_id": "REQ-001",
      "criteria": [
        {
          "id": "AC-001",
          "description": "User can register with email and password",
          "testable": true,
          "test_method": "e2e"
        },
        {
          "id": "AC-002", 
          "description": "User can log in with valid credentials",
          "testable": true,
          "test_method": "e2e"
        },
        {
          "id": "AC-003",
          "description": "User cannot log in with invalid credentials",
          "testable": true,
          "test_method": "e2e"
        },
        {
          "id": "AC-004",
          "description": "User can enable two-factor authentication",
          "testable": true,
          "test_method": "integration"
        }
      ]
    },
    {
      "requirement_id": "REQ-002",
      "criteria": [
        {
          "id": "AC-005",
          "description": "User can create a new task with title and description",
          "testable": true,
          "test_method": "e2e"
        },
        {
          "id": "AC-006",
          "description": "User can edit existing task details",
          "testable": true,
          "test_method": "e2e"
        },
        {
          "id": "AC-007",
          "description": "User can delete tasks they own",
          "testable": true,
          "test_method": "e2e"
        },
        {
          "id": "AC-008",
          "description": "Task status updates are reflected immediately in UI",
          "testable": true,
          "test_method": "integration"
        }
      ]
    },
    {
      "requirement_id": "REQ-004",
      "criteria": [
        {
          "id": "AC-009",
          "description": "Changes made by one user appear in real-time for other users",
          "testable": true,
          "test_method": "e2e"
        },
        {
          "id": "AC-010",
          "description": "System handles concurrent edits gracefully",
          "testable": true,
          "test_method": "integration"
        }
      ]
    }
  ],
  "constraints": {
    "budget": {
      "time_budget_hours": 2000,
      "compute_budget": "Medium - can handle 1000 concurrent users"
    },
    "technical": [
      "Must use modern web technologies (React/Vue.js frontend)",
      "Backend must be API-first design",
      "Database must support ACID transactions",
      "Must be deployable on cloud platforms"
    ],
    "regulatory": [
      "Must comply with GDPR for EU users",
      "Must implement proper data retention policies",
      "User data must be encrypted at rest and in transit"
    ]
  },
  "stakeholders": [
    {
      "name": "Sarah Johnson",
      "role": "Product Manager",
      "involvement": "owner",
      "contact": "sarah.johnson@company.com"
    },
    {
      "name": "Mike Chen",
      "role": "Engineering Lead",
      "involvement": "contributor",
      "contact": "mike.chen@company.com"
    },
    {
      "name": "Lisa Rodriguez",
      "role": "UX Designer",
      "involvement": "contributor", 
      "contact": "lisa.rodriguez@company.com"
    },
    {
      "name": "David Kim",
      "role": "QA Lead",
      "involvement": "contributor",
      "contact": "david.kim@company.com"
    },
    {
      "name": "Jennifer Walsh",
      "role": "Business Stakeholder",
      "involvement": "approver",
      "contact": "jennifer.walsh@company.com"
    }
  ]
}
